id,tag,text
1,"[1, 'label']",77
2,"[2, 'd', 'content']","Para Jedutum, regente do coral: salmo de Asafe."
3,"[3, 'q', 'verse', 'v1', 'label']",1
4,"[4, 'q', 'verse', 'v1', 'content']","Clamo a Deus; sim, grito bem alto."
5,"[5, 'q', 'verse', 'v1', 'content']",Quem dera Deus me ouvisse!
6,"[6, 'q', 'verse', 'v1', 'plain_text']","1 Clamo a Deus; sim, grito bem alto. Quem dera Deus me ouvisse!"
7,"[7, 'q', 'verse', 'v2', 'label']",2
8,"[8, 'q', 'verse', 'v2', 'content']","Quando eu estava angustiado,"
9,"[9, 'q', 'verse', 'v2', 'content']",busquei o Senhor.
10,"[10, 'q', 'verse', 'v2', 'content']","Orei a noite toda, de mãos estendidas para o céu,"
11,"[11, 'q', 'verse', 'v2', 'content']",mas minha alma recusou ser consolada.
12,"[12, 'q', 'verse', 'v2', 'plain_text']","2 Quando eu estava angustiado, busquei o Senhor. Orei a noite toda, de mãos estendidas para o céu, mas minha alma recusou ser consolada."
13,"[13, 'q', 'verse', 'v3', 'label']",3
14,"[14, 'q', 'verse', 'v3', 'content']",Lembro-me de Deus e começo a gemer;
15,"[15, 'q', 'verse', 'v3', 'content']","desfaleço, ansioso por sua ajuda."
16,"[16, 'q', 'verse', 'v3', 'plain_text']","3 Lembro-me de Deus e começo a gemer; desfaleço, ansioso por sua ajuda."
17,"[17, 'qa', 'heading']",Interlúdio
18,"[18, 'q', 'verse', 'v4', 'label']",4
19,"[19, 'q', 'verse', 'v4', 'content']",Tu não me deixas dormir;
20,"[20, 'q', 'verse', 'v4', 'content']",estou tão desesperado que nem consigo falar!
21,"[21, 'q', 'verse', 'v4', 'plain_text']",4 Tu não me deixas dormir; estou tão desesperado que nem consigo falar!
22,"[22, 'q', 'verse', 'v5', 'label']",5
23,"[23, 'q', 'verse', 'v5', 'content']","Penso nos dias que passaram,"
24,"[24, 'q', 'verse', 'v5', 'content']",nos anos que há muito se foram.
25,"[25, 'q', 'verse', 'v5', 'plain_text']","5 Penso nos dias que passaram, nos anos que há muito se foram."
26,"[26, 'q', 'verse', 'v6', 'label']",6
27,"[27, 'q', 'verse', 'v6', 'content']","À noite, relembro canções alegres;"
28,"[28, 'q', 'verse', 'v6', 'content']",consulto minha alma e procuro compreender minha situação.
29,"[29, 'q', 'verse', 'v6', 'plain_text']","6 À noite, relembro canções alegres; consulto minha alma e procuro compreender minha situação."
30,"[30, 'q', 'verse', 'v7', 'label']",7
31,"[31, 'q', 'verse', 'v7', 'content']",Acaso o Senhor me rejeitou em definitivo?
32,"[32, 'q', 'verse', 'v7', 'content']",Jamais voltará a ser bondoso comigo?
33,"[33, 'q', 'verse', 'v7', 'plain_text']",7 Acaso o Senhor me rejeitou em definitivo? Jamais voltará a ser bondoso comigo?
34,"[34, 'q', 'verse', 'v8', 'label']",8
35,"[35, 'q', 'verse', 'v8', 'content']",Seu amor se foi para nunca mais voltar?
36,"[36, 'q', 'verse', 'v8', 'content']",Deixou de cumprir suas promessas para sempre?
37,"[37, 'q', 'verse', 'v8', 'plain_text']",8 Seu amor se foi para nunca mais voltar? Deixou de cumprir suas promessas para sempre?
38,"[38, 'q', 'verse', 'v9', 'label']",9
39,"[39, 'q', 'verse', 'v9', 'content']",Deus se esqueceu de ser bondoso?
40,"[40, 'q', 'verse', 'v9', 'content']","Em sua ira, fechou a porta para a compaixão?"
41,"[41, 'q', 'verse', 'v9', 'plain_text']","9 Deus se esqueceu de ser bondoso? Em sua ira, fechou a porta para a compaixão?"
42,"[42, 'qa', 'heading']",Interlúdio
43,"[43, 'q', 'verse', 'v10', 'label']",10
44,"[44, 'q', 'verse', 'v10', 'content']",Pensei: “É por esta razão que sofro;
45,"[45, 'q', 'verse', 'v10', 'content']",o Altíssimo voltou sua mão direita contra mim”.
46,"[46, 'q', 'verse', 'v10', 'plain_text']",10 Pensei: “É por esta razão que sofro; o Altíssimo voltou sua mão direita contra mim”.
47,"[47, 'q', 'verse', 'v11', 'label']",11
48,"[48, 'q', 'verse', 'v11', 'content']","Depois, porém, lembro-me de tudo que fizeste, S"
49,"[49, 'q', 'verse', 'v11', 'sc']",enhor
50,"[50, 'q', 'verse', 'v11', 'content']",;
51,"[51, 'q', 'verse', 'v11', 'content']",recordo-me de tuas maravilhas do passado.
52,"[52, 'q', 'verse', 'v11', 'plain_text']","11 Depois, porém, lembro-me de tudo que fizeste, S enhor ; recordo-me de tuas maravilhas do passado."
53,"[53, 'q', 'verse', 'v12', 'label']",12
54,"[54, 'q', 'verse', 'v12', 'content']",Estão sempre em meus pensamentos;
55,"[55, 'q', 'verse', 'v12', 'content']",não deixo de refletir sobre teus poderosos feitos.
56,"[56, 'q', 'verse', 'v12', 'plain_text']",12 Estão sempre em meus pensamentos; não deixo de refletir sobre teus poderosos feitos.
57,"[57, 'q', 'verse', 'v13', 'label']",13
58,"[58, 'q', 'verse', 'v13', 'content']","Teus caminhos, ó Deus, são santos;"
59,"[59, 'q', 'verse', 'v13', 'content']",que deus é poderoso como o nosso Deus?
60,"[60, 'q', 'verse', 'v13', 'plain_text']","13 Teus caminhos, ó Deus, são santos; que deus é poderoso como o nosso Deus?"
61,"[61, 'q', 'verse', 'v14', 'label']",14
62,"[62, 'q', 'verse', 'v14', 'content']",És o Deus que realiza maravilhas;
63,"[63, 'q', 'verse', 'v14', 'content']",mostras o teu poder entre as nações!
64,"[64, 'q', 'verse', 'v14', 'plain_text']",14 És o Deus que realiza maravilhas; mostras o teu poder entre as nações!
65,"[65, 'q', 'verse', 'v15', 'label']",15
66,"[66, 'q', 'verse', 'v15', 'content']","Com teu braço forte resgataste teu povo,"
67,"[67, 'q', 'verse', 'v15', 'content']",os descendentes de Jacó e José.
68,"[68, 'q', 'verse', 'v15', 'plain_text']","15 Com teu braço forte resgataste teu povo, os descendentes de Jacó e José."
69,"[69, 'qa', 'heading']",Interlúdio
70,"[70, 'q', 'verse', 'v16', 'label']",16
71,"[71, 'q', 'verse', 'v16', 'content']","As águas te viram, ó Deus,"
72,"[72, 'q', 'verse', 'v16', 'content']",as águas te viram e estremeceram;
73,"[73, 'q', 'verse', 'v16', 'content']",até as profundezas do mar se agitaram.
74,"[74, 'q', 'verse', 'v16', 'plain_text']","16 As águas te viram, ó Deus, as águas te viram e estremeceram; até as profundezas do mar se agitaram."
75,"[75, 'q', 'verse', 'v17', 'label']",17
76,"[76, 'q', 'verse', 'v17', 'content']","As nuvens derramaram chuva,"
77,"[77, 'q', 'verse', 'v17', 'content']","os trovões ressoaram nas alturas,"
78,"[78, 'q', 'verse', 'v17', 'content']",os teus relâmpagos riscaram os céus.
79,"[79, 'q', 'verse', 'v17', 'plain_text']","17 As nuvens derramaram chuva, os trovões ressoaram nas alturas, os teus relâmpagos riscaram os céus."
80,"[80, 'q', 'verse', 'v18', 'label']",18
81,"[81, 'q', 'verse', 'v18', 'content']",No redemoinho ouviu-se o estrondo de teu trovão;
82,"[82, 'q', 'verse', 'v18', 'content']","os relâmpagos iluminaram o mundo,"
83,"[83, 'q', 'verse', 'v18', 'content']",e a terra tremeu e se abalou.
84,"[84, 'q', 'verse', 'v18', 'plain_text']","18 No redemoinho ouviu-se o estrondo de teu trovão; os relâmpagos iluminaram o mundo, e a terra tremeu e se abalou."
85,"[85, 'q', 'verse', 'v19', 'label']",19
86,"[86, 'q', 'verse', 'v19', 'content']","Teu caminho passou pelo mar,"
87,"[87, 'q', 'verse', 'v19', 'content']","teu trajeto, pelas águas poderosas,"
88,"[88, 'q', 'verse', 'v19', 'content']",e ninguém percebeu teus passos.
89,"[89, 'q', 'verse', 'v19', 'plain_text']","19 Teu caminho passou pelo mar, teu trajeto, pelas águas poderosas, e ninguém percebeu teus passos."
90,"[90, 'q', 'verse', 'v20', 'label']",20
91,"[91, 'q', 'verse', 'v20', 'content']","Conduziste teu povo como um rebanho de ovelhas,"
92,"[92, 'q', 'verse', 'v20', 'content']",pelas mãos de Moisés e Arão.
93,"[93, 'q', 'verse', 'v20', 'plain_text']","20 Conduziste teu povo como um rebanho de ovelhas, pelas mãos de Moisés e Arão."
