id,tag,text
164,"['p5', 'verse', 'v31', 'note', 'f']","tn The word is מְנֹרָה (mÿnorah) – here in construct to a following genitive of material. The main piece was one lampstand, but there were seven lamps on the shaft and its branches. See E. Goodenough, “The Menorah among the Jews of the Roman World,” HUCA 23 (1950/51): 449-92."
165,"['p5', 'verse', 'v31', 'content']","of pure gold. The lampstand is to be made of hammered metal; its base and its shaft, its cups,"
166,"['p5', 'verse', 'v31', 'note', 'f']","sn U. Cassuto (Exodus, 342-44) says that the description “the cups, knobs and flowers” is explained in vv. 32-36 as three decorations in the form of a cup, shaped like an almond blossom, to be made on one branch. Every cup will have two parts, (a) a knob, that is, the receptacle at the base of the blossom, and (b) a flower, which is called the corolla, so that each lamp rests on top of a flower."
167,"['p5', 'verse', 'v31', 'content']","its buds, and its blossoms are to be from the same piece."
168,"['p5', 'verse', 'v31', 'note', 'f']",tn Heb “will be from/of it”; the referent (“the same piece” of wrought metal) has been specified in the translation for clarity.
170,"['p5', 'verse', 'v32', 'label']",32
171,"['p5', 'verse', 'v32', 'content']","Six branches are to extend from the sides of the lampstand,"
172,"['p5', 'verse', 'v32', 'note', 'f']",tn Heb “from the sides of it.”
173,"['p5', 'verse', 'v32', 'content']",three branches of the lampstand from one side of it and three branches of the lampstand from the other side of it.
174,"['p5', 'verse', 'v32', 'note', 'f']",tn Heb “from the second side.”
176,"['p5', 'verse', 'v33', 'label']",33
177,"['p5', 'verse', 'v33', 'content']","Three cups shaped like almond flowers with buds and blossoms are to be on one branch, and three cups shaped like almond flowers with buds and blossoms are to be on the next"
178,"['p5', 'verse', 'v33', 'note', 'f']",tn The text uses “one” again; “the one…the one” means “the one…and the next” in the distributive sense.
179,"['p5', 'verse', 'v33', 'content']","branch, and the same"
180,"['p5', 'verse', 'v33', 'note', 'f']",tn Heb “thus.”
181,"['p5', 'verse', 'v33', 'content']",for the six branches extending from the lampstand.
182,"['p5', 'verse', 'v34', 'label']",34
183,"['p5', 'verse', 'v34', 'content']","On the lampstand there are to be four cups shaped like almond flowers with buds and blossoms,"
184,"['p5', 'verse', 'v35', 'label']",35
185,"['p5', 'verse', 'v35', 'content']",with a bud under the first
186,"['p5', 'verse', 'v35', 'note', 'f']",tn For clarity the phrase “the first” has been supplied.
187,"['p5', 'verse', 'v35', 'content']","two branches from it, and a bud under the next"
188,"['p5', 'verse', 'v35', 'note', 'f']",tn For clarity the phrase “the next” has been supplied.
189,"['p5', 'verse', 'v35', 'content']","two branches from it, and a bud under the third"
190,"['p5', 'verse', 'v35', 'note', 'f']",tn For clarity the phrase “the third” has been supplied.
191,"['p5', 'verse', 'v35', 'content']","two branches from it, according to the six branches that extend from the lampstand."
192,"['p5', 'verse', 'v36', 'label']",36
193,"['p5', 'verse', 'v36', 'content']","Their buds and their branches will be one piece,"
194,"['p5', 'verse', 'v36', 'note', 'f']",tn Heb “will be from it.”
195,"['p5', 'verse', 'v36', 'content']",all of it one hammered piece of pure gold.
196,"['p6', 'verse', 'v37', 'label']",37
197,"['p6', 'verse', 'v37', 'content']","“You are to make its seven lamps,"
198,"['p6', 'verse', 'v37', 'note', 'f']","tn The word for “lamps” is from the same root as the lampstand, of course. The word is נֵרוֹת (nerot). This probably refers to the small saucer-like pottery lamps that are made very simply with the rim pinched over to form a place to lay the wick. The bowl is then filled with olive oil as fuel."
199,"['p6', 'verse', 'v37', 'content']",and then set
200,"['p6', 'verse', 'v37', 'note', 'f']","tn The translation “set up on” is from the Hebrew verb “bring up.” The construction is impersonal, “and he will bring up,” meaning “one will bring up.” It may mean that people were to fix the lamps on to the shaft and the branches, rather than cause the light to go up (see S. R. Driver, Exodus, 277)."
201,"['p6', 'verse', 'v37', 'content']","its lamps up on it, so that it will give light"
202,"['p6', 'verse', 'v37', 'note', 'f']","tn This is a Hiphil perfect with vav consecutive, from אוֹר (’or, “light”), and in the causative, “to light, give light.”"
203,"['p6', 'verse', 'v37', 'content']",to the area in front of it.
204,"['p6', 'verse', 'v38', 'label']",38
205,"['p6', 'verse', 'v38', 'content']",Its trimmers and its trays
206,"['p6', 'verse', 'v38', 'note', 'f']",sn The first word refers to something like small tongs or tweezers used to pull up and trim the wicks; the second word refers to fire-pans or censers.
207,"['p6', 'verse', 'v38', 'content']",are to be
208,"['p6', 'verse', 'v38', 'note', 'f']",tn “are to be” has been supplied.
209,"['p6', 'verse', 'v38', 'content']",of pure gold.
210,"['p6', 'verse', 'v39', 'label']",39
211,"['p6', 'verse', 'v39', 'content']",About seventy-five pounds
212,"['p6', 'verse', 'v39', 'note', 'f']",tn Heb “a talent.”
213,"['p6', 'verse', 'v39', 'content']",of pure gold is to be used for it
214,"['p6', 'verse', 'v39', 'note', 'f']",tn The text has “he will make it” or “one will make it.” With no expressed subject it is given a passive translation.
215,"['p6', 'verse', 'v39', 'content']",and for all these utensils.
216,"['p6', 'verse', 'v40', 'label']",40
217,"['p6', 'verse', 'v40', 'content']",Now be sure to make
218,"['p6', 'verse', 'v40', 'note', 'f']","tn The text uses two imperatives: “see and make.” This can be interpreted as a verbal hendiadys, calling for Moses and Israel to see to it that they make these things correctly."
219,"['p6', 'verse', 'v40', 'content']",them according to the pattern you were shown
220,"['p6', 'verse', 'v40', 'note', 'f']","tn The participle is passive, “caused to see,” or, “shown.”"
221,"['p6', 'verse', 'v40', 'content']",on the mountain.
222,"['p6', 'verse', 'v40', 'note', 'f']","sn The message of this section surely concerns access to God. To expound this correctly, though, since it is an instruction section for building the lampstand, the message would be: God requires that his people ensure that light will guide the way of access to God. The breakdown for exposition could be the instructions for preparation for light (one lamp, several branches), then instructions for the purpose and maintenance of the lamps, and then the last verse telling the divine source for the instructions. Naturally, the metaphorical value of light will come up in the study, especially from the NT. So in the NT there is the warning that if churches are unfaithful God will remove their lampstand, their ministry (Rev 2-3)."
